{
  "$schema": "../../schemas/module.schema.json",
  "id": "production",
  "version": "0.1.0-alpha.1",
  "dependencies": [
    "foundation"
  ],
  "agents": [
    "dreamy-performance-engineer",
    "dreamy-release-validator"
  ],
  "content": [
    "skills/production/production-code-review",
    "skills/production/production-release"
  ]
}
