{
  "$schema": "../../schemas/module.schema.json",
  "id": "unity-core",
  "version": "0.1.0-alpha.1",
  "dependencies": [
    "foundation"
  ],
  "agents": [
    "dreamy-unity-developer",
    "dreamy-unity-editor",
    "dreamy-mcp-operator"
  ],
  "content": [
    "skills/unity-mcp",
    "skills/unity-ui",
    "skills/unity-ui-reskin",
    "skills/unity-input-system",
    "skills/unity-physics",
    "skills/unity-physics2d",
    "skills/unity-animation",
    "skills/unity-camera",
    "skills/unity-addressables",
    "skills/unity-profiling",
    "skills/unity-memory"
  ]
}
